"Region","Public administration"
"Abilene, TX Metro Area","1,886"
"Aguadilla, PR Metro Area","2,863"
"Akron, OH Metro Area","4,424"
"Albany, GA Metro Area","2,083"
"Albany, OR Metro Area","2,175"
"Albany-Schenectady-Troy, NY Metro Area","21,938"
"Albuquerque, NM Metro Area","13,881"
"Alexandria, LA Metro Area","2,155"
"Allentown-Bethlehem-Easton, PA-NJ Metro Area","4,350"
"Altoona, PA Metro Area","805"
"Amarillo, TX Metro Area","3,085"
"Ames, IA Metro Area","1,274"
"Amherst Town-Northampton, MA Metro Area","1,433"
"Anchorage, AK Metro Area","8,489"
"Ann Arbor, MI Metro Area","2,142"
"Anniston-Oxford, AL Metro Area","1,265"
"Appleton, WI Metro Area","1,473"
"Arecibo, PR Metro Area","2,320"
"Asheville, NC Metro Area","3,186"
"Athens-Clarke County, GA Metro Area","1,706"
"Atlanta-Sandy Springs-Roswell, GA Metro Area","64,709"
"Atlantic City-Hammonton, NJ Metro Area","3,634"
"Auburn-Opelika, AL Metro Area","1,423"
"Augusta-Richmond County, GA-SC Metro Area","6,988"
"Austin-Round Rock-San Marcos, TX Metro Area","39,209"
"Bakersfield-Delano, CA Metro Area","8,912"
"Baltimore-Columbia-Towson, MD Metro Area","67,082"
"Bangor, ME Metro Area","1,521"
"Barnstable Town, MA Metro Area","2,150"
"Baton Rouge, LA Metro Area","14,266"
"Battle Creek, MI Metro Area","1,400"
"Bay City, MI Metro Area","691"
"Beaumont-Port Arthur, TX Metro Area","3,730"
"Beckley, WV Metro Area","1,306"
"Bellingham, WA Metro Area","2,449"
"Bend, OR Metro Area","2,614"
"Billings, MT Metro Area","2,120"
"Binghamton, NY Metro Area","2,243"
"Birmingham, AL Metro Area","10,567"
"Bismarck, ND Metro Area","2,416"
"Blacksburg-Christiansburg-Radford, VA Metro Area","1,295"
"Bloomington, IL Metro Area","1,019"
"Bloomington, IN Metro Area","1,350"
"Boise City, ID Metro Area","8,699"
"Boston-Cambridge-Newton, MA-NH Metro Area","44,003"
"Boulder, CO Metro Area","2,253"
"Bowling Green, KY Metro Area","1,068"
"Bozeman, MT Metro Area","800"
"Bremerton-Silverdale-Port Orchard, WA Metro Area","4,378"
"Bridgeport-Stamford-Danbury, CT Metro Area","5,236"
"Brownsville-Harlingen, TX Metro Area","3,055"
"Brunswick-St. Simons, GA Metro Area","1,579"
"Buffalo-Cheektowaga, NY Metro Area","10,548"
"Burlington, NC Metro Area","1,129"
"Burlington-South Burlington, VT Metro Area","3,480"
"Canton-Massillon, OH Metro Area","2,267"
"Cape Coral-Fort Myers, FL Metro Area","5,084"
"Cape Girardeau, MO-IL Metro Area","1,037"
"Carson City, NV Metro Area","1,633"
"Casper, WY Metro Area","811"
"Cedar Rapids, IA Metro Area","1,643"
"Chambersburg, PA Metro Area","1,633"
"Champaign-Urbana, IL Metro Area","1,447"
"Charleston, WV Metro Area","4,210"
"Charleston-North Charleston, SC Metro Area","9,146"
"Charlotte-Concord-Gastonia, NC-SC Metro Area","16,131"
"Charlottesville, VA Metro Area","1,910"
"Chattanooga, TN-GA Metro Area","3,451"
"Cheyenne, WY Metro Area","2,506"
"Chicago-Naperville-Elgin, IL-IN Metro Area","68,480"
"Chico, CA Metro Area","2,127"
"Cincinnati, OH-KY-IN Metro Area","16,287"
"Clarksville, TN-KY Metro Area","3,607"
"Cleveland, OH Metro Area","19,005"
"Cleveland, TN Metro Area","743"
"Coeur d'Alene, ID Metro Area","1,638"
"College Station-Bryan, TX Metro Area","1,960"
"Colorado Springs, CO Metro Area","7,050"
"Columbia, MO Metro Area","2,052"
"Columbia, SC Metro Area","14,462"
"Columbus, GA-AL Metro Area","4,183"
"Columbus, IN Metro Area","458"
"Columbus, OH Metro Area","22,426"
"Corpus Christi, TX Metro Area","4,467"
"Corvallis, OR Metro Area","835"
"Crestview-Fort Walton Beach-Destin, FL Metro Area","4,139"
"Dallas-Fort Worth-Arlington, TX Metro Area","51,371"
"Dalton, GA Metro Area","650"
"Daphne-Fairhope-Foley, AL Metro Area","1,860"
"Davenport-Moline-Rock Island, IA-IL Metro Area","4,139"
"Dayton-Kettering-Beavercreek, OH Metro Area","8,236"
"Decatur, AL Metro Area","1,145"
"Decatur, IL Metro Area","817"
"Deltona-Daytona Beach-Ormond Beach, FL Metro Area","5,731"
"Denver-Aurora-Centennial, CO Metro Area","33,727"
"Des Moines-West Des Moines, IA Metro Area","6,234"
"Detroit-Warren-Dearborn, MI Metro Area","32,715"
"Dothan, AL Metro Area","1,446"
"Dover, DE Metro Area","3,913"
"Dubuque, IA Metro Area","427"
"Duluth, MN-WI Metro Area","3,147"
"Durham-Chapel Hill, NC Metro Area","4,924"
"Eagle Pass, TX Metro Area","645"
"Eau Claire, WI Metro Area","1,206"
"El Centro, CA Metro Area","2,436"
"Elizabethtown, KY Metro Area","1,859"
"Elkhart-Goshen, IN Metro Area","723"
"Elmira, NY Metro Area","615"
"El Paso, TX Metro Area","9,988"
"Enid, OK Metro Area","737"
"Erie, PA Metro Area","1,940"
"Eugene-Springfield, OR Metro Area","3,683"
"Evansville, IN Metro Area","1,617"
"Fairbanks-College, AK Metro Area","1,486"
"Fargo, ND-MN Metro Area","2,151"
"Farmington, NM Metro Area","1,255"
"Fayetteville, NC Metro Area","5,075"
"Fayetteville-Springdale-Rogers, AR Metro Area","2,533"
"Flagstaff, AZ Metro Area","1,451"
"Flint, MI Metro Area","2,805"
"Florence, SC Metro Area","1,624"
"Florence-Muscle Shoals, AL Metro Area","1,271"
"Fond du Lac, WI Metro Area","986"
"Fort Collins-Loveland, CO Metro Area","3,291"
"Fort Smith, AR-OK Metro Area","1,643"
"Fort Wayne, IN Metro Area","2,394"
"Fresno, CA Metro Area","14,856"
"Gadsden, AL Metro Area","869"
"Gainesville, FL Metro Area","3,787"
"Gainesville, GA Metro Area","688"
"Gettysburg, PA Metro Area","1,168"
"Glens Falls, NY Metro Area","1,862"
"Goldsboro, NC Metro Area","1,099"
"Grand Forks, ND-MN Metro Area","779"
"Grand Island, NE Metro Area","712"
"Grand Junction, CO Metro Area","1,531"
"Grand Rapids-Wyoming-Kentwood, MI Metro Area","6,107"
"Grants Pass, OR Metro Area","917"
"Great Falls, MT Metro Area","968"
"Greeley, CO Metro Area","3,218"
"Green Bay, WI Metro Area","2,448"
"Greensboro-High Point, NC Metro Area","5,050"
"Greenville, NC Metro Area","1,091"
"Greenville-Anderson-Greer, SC Metro Area","6,119"
"Guayama, PR Metro Area","965"
"Gulfport-Biloxi, MS Metro Area","4,745"
"Hagerstown-Martinsburg, MD-WV Metro Area","4,605"
"Hammond, LA Metro Area","1,264"
"Hanford-Corcoran, CA Metro Area","2,246"
"Harrisburg-Carlisle, PA Metro Area","10,526"
"Harrisonburg, VA Metro Area","692"
"Hartford-West Hartford-East Hartford, CT Metro Area","10,318"
"Hattiesburg, MS Metro Area","1,661"
"Helena, MT Metro Area","3,888"
"Hickory-Lenoir-Morganton, NC Metro Area","2,666"
"Hilton Head Island-Bluffton-Port Royal, SC Metro Area","1,489"
"Hinesville, GA Metro Area","1,137"
"Homosassa Springs, FL Metro Area","880"
"Hot Springs, AR Metro Area","780"
"Houma-Bayou Cane-Thibodaux, LA Metro Area","1,882"
"Houston-Pasadena-The Woodlands, TX Metro Area","49,036"
"Huntington-Ashland, WV-KY-OH Metro Area","3,773"
"Huntsville, AL Metro Area","7,697"
"Idaho Falls, ID Metro Area","1,337"
"Indianapolis-Carmel-Greenwood, IN Metro Area","20,117"
"Iowa City, IA Metro Area","1,212"
"Ithaca, NY Metro Area","646"
"Jackson, MI Metro Area","1,738"
"Jackson, MS Metro Area","9,580"
"Jackson, TN Metro Area","1,579"
"Jacksonville, FL Metro Area","14,703"
"Jacksonville, NC Metro Area","1,891"
"Janesville-Beloit, WI Metro Area","1,471"
"Jefferson City, MO Metro Area","4,911"
"Johnson City, TN Metro Area","1,483"
"Johnstown, PA Metro Area","1,187"
"Jonesboro, AR Metro Area","992"
"Joplin, MO-KS Metro Area","1,267"
"Kahului-Wailuku, HI Metro Area","1,653"
"Kalamazoo-Portage, MI Metro Area","1,762"
"Kankakee, IL Metro Area","601"
"Kansas City, MO-KS Metro Area","22,124"
"Kennewick-Richland, WA Metro Area","2,915"
"Kenosha, WI Metro Area","1,365"
"Killeen-Temple, TX Metro Area","7,686"
"Kingsport-Bristol, TN-VA Metro Area","2,422"
"Kingston, NY Metro Area","1,687"
"Kiryas Joel-Poughkeepsie-Newburgh, NY Metro Area","6,788"
"Knoxville, TN Metro Area","6,667"
"Kokomo, IN Metro Area","640"
"La Crosse-Onalaska, WI-MN Metro Area","1,754"
"Lafayette, LA Metro Area","3,307"
"Lafayette-West Lafayette, IN Metro Area","1,131"
"Lake Charles, LA Metro Area","1,852"
"Lake Havasu City-Kingman, AZ Metro Area","1,789"
"Lakeland-Winter Haven, FL Metro Area","6,429"
"Lancaster, PA Metro Area","2,564"
"Lansing-East Lansing, MI Metro Area","10,416"
"Laredo, TX Metro Area","2,067"
"Las Cruces, NM Metro Area","2,869"
"Las Vegas-Henderson-North Las Vegas, NV Metro Area","15,819"
"Lawrence, KS Metro Area","1,424"
"Lawton, OK Metro Area","1,865"
"Lebanon, PA Metro Area","1,331"
"Lewiston, ID-WA Metro Area","1,023"
"Lewiston-Auburn, ME Metro Area","1,102"
"Lexington-Fayette, KY Metro Area","4,441"
"Lexington Park, MD Metro Area","7,471"
"Lima, OH Metro Area","534"
"Lincoln, NE Metro Area","5,778"
"Little Rock-North Little Rock-Conway, AR Metro Area","10,671"
"Logan, UT-ID Metro Area","1,070"
"Longview, TX Metro Area","2,311"
"Longview-Kelso, WA Metro Area","1,216"
"Los Angeles-Long Beach-Anaheim, CA Metro Area","116,232"
"Louisville/Jefferson County, KY-IN Metro Area","10,286"
"Lubbock, TX Metro Area","3,045"
"Lynchburg, VA Metro Area","2,154"
"Macon-Bibb County, GA Metro Area","3,115"
"Madison, WI Metro Area","9,116"
"Manchester-Nashua, NH Metro Area","2,951"
"Manhattan, KS Metro Area","1,427"
"Mankato, MN Metro Area","678"
"Mansfield, OH Metro Area","799"
"Mayagüez, PR Metro Area","2,252"
"McAllen-Edinburg-Mission, TX Metro Area","5,781"
"Medford, OR Metro Area","2,080"
"Memphis, TN-MS-AR Metro Area","16,132"
"Merced, CA Metro Area","2,249"
"Miami-Fort Lauderdale-West Palm Beach, FL Metro Area","49,921"
"Michigan City-La Porte, IN Metro Area","1,054"
"Midland, MI Metro Area","521"
"Midland, TX Metro Area","1,330"
"Milwaukee-Waukesha, WI Metro Area","10,092"
"Minneapolis-St. Paul-Bloomington, MN-WI Metro Area","36,788"
"Minot, ND Metro Area","937"
"Missoula, MT Metro Area","1,255"
"Mobile, AL Metro Area","2,940"
"Modesto, CA Metro Area","4,972"
"Monroe, LA Metro Area","2,404"
"Monroe, MI Metro Area","1,116"
"Montgomery, AL Metro Area","9,563"
"Morgantown, WV Metro Area","1,383"
"Morristown, TN Metro Area","747"
"Mount Vernon-Anacortes, WA Metro Area","1,147"
"Muncie, IN Metro Area","664"
"Muskegon-Norton Shores, MI Metro Area","1,370"
"Myrtle Beach-Conway-North Myrtle Beach, SC Metro Area","2,295"
"Napa, CA Metro Area","1,581"
"Naples-Marco Island, FL Metro Area","2,027"
"Nashville-Davidson--Murfreesboro--Franklin, TN Metro Area","20,007"
"New Haven, CT Metro Area","4,684"
"New Orleans-Metairie, LA Metro Area","11,942"
"New York-Newark-Jersey City, NY-NJ Metro Area","165,527"
"Niles, MI Metro Area","1,106"
"North Port-Bradenton-Sarasota, FL Metro Area","5,644"
"Norwich-New London-Willimantic, CT Metro Area","2,378"
"Ocala, FL Metro Area","3,298"
"Odessa, TX Metro Area","791"
"Ogden, UT Metro Area","10,723"
"Oklahoma City, OK Metro Area","18,911"
"Olympia-Lacey-Tumwater, WA Metro Area","11,872"
"Omaha, NE-IA Metro Area","7,439"
"Orlando-Kissimmee-Sanford, FL Metro Area","21,981"
"Oshkosh-Neenah, WI Metro Area","1,565"
"Owensboro, KY Metro Area","735"
"Oxnard-Thousand Oaks-Ventura, CA Metro Area","8,886"
"Paducah, KY-IL Metro Area","1,167"
"Palm Bay-Melbourne-Titusville, FL Metro Area","5,890"
"Panama City-Panama City Beach, FL Metro Area","3,527"
"Parkersburg-Vienna, WV Metro Area","1,551"
"Pensacola-Ferry Pass-Brent, FL Metro Area","5,139"
"Peoria, IL Metro Area","2,476"
"Philadelphia-Camden-Wilmington, PA-NJ-DE-MD Metro Area","61,339"
"Phoenix-Mesa-Chandler, AZ Metro Area","43,914"
"Pinehurst-Southern Pines, NC Metro Area","1,285"
"Pittsburgh, PA Metro Area","16,070"
"Pittsfield, MA Metro Area","946"
"Pocatello, ID Metro Area","924"
"Ponce, PR Metro Area","2,990"
"Portland-South Portland, ME Metro Area","3,852"
"Portland-Vancouver-Hillsboro, OR-WA Metro Area","24,936"
"Port St. Lucie, FL Metro Area","3,397"
"Prescott Valley-Prescott, AZ Metro Area","1,846"
"Providence-Warwick, RI-MA Metro Area","13,912"
"Provo-Orem-Lehi, UT Metro Area","3,694"
"Pueblo, CO Metro Area","2,171"
"Punta Gorda, FL Metro Area","1,264"
"Racine-Mount Pleasant, WI Metro Area","1,490"
"Raleigh-Cary, NC Metro Area","17,787"
"Rapid City, SD Metro Area","1,356"
"Reading, PA Metro Area","2,443"
"Redding, CA Metro Area","2,539"
"Reno, NV Metro Area","5,553"
"Richmond, VA Metro Area","23,285"
"Riverside-San Bernardino-Ontario, CA Metro Area","51,256"
"Roanoke, VA Metro Area","3,080"
"Rochester, MN Metro Area","1,645"
"Rochester, NY Metro Area","8,866"
"Rockford, IL Metro Area","2,054"
"Rocky Mount, NC Metro Area","1,498"
"Rome, GA Metro Area","749"
"Sacramento-Roseville-Folsom, CA Metro Area","56,757"
"Saginaw, MI Metro Area","1,460"
"St. Cloud, MN Metro Area","1,340"
"St. George, UT Metro Area","1,244"
"St. Joseph, MO-KS Metro Area","1,158"
"St. Louis, MO-IL Metro Area","23,809"
"Salem, OR Metro Area","9,344"
"Salinas, CA Metro Area","4,636"
"Salisbury, MD Metro Area","1,813"
"Salt Lake City-Murray, UT Metro Area","11,270"
"San Angelo, TX Metro Area","1,465"
"San Antonio-New Braunfels, TX Metro Area","25,639"
"San Diego-Chula Vista-Carlsbad, CA Metro Area","32,487"
"Sandusky, OH Metro Area","914"
"San Francisco-Oakland-Fremont, CA Metro Area","46,826"
"San Jose-Sunnyvale-Santa Clara, CA Metro Area","14,392"
"San Juan-Bayamón-Caguas, PR Metro Area","29,162"
"San Luis Obispo-Paso Robles, CA Metro Area","3,041"
"Santa Cruz-Watsonville, CA Metro Area","2,362"
"Santa Fe, NM Metro Area","3,428"
"Santa Maria-Santa Barbara, CA Metro Area","4,650"
"Santa Rosa-Petaluma, CA Metro Area","5,000"
"Savannah, GA Metro Area","3,920"
"Scranton--Wilkes-Barre, PA Metro Area","4,718"
"Seattle-Tacoma-Bellevue, WA Metro Area","36,496"
"Sebastian-Vero Beach-West Vero Corridor, FL Metro Area","1,041"
"Sebring, FL Metro Area","961"
"Sheboygan, WI Metro Area","766"
"Sherman-Denison, TX Metro Area","850"
"Shreveport-Bossier City, LA Metro Area","4,014"
"Sierra Vista-Douglas, AZ Metro Area","1,894"
"Sioux City, IA-NE-SD Metro Area","1,189"
"Sioux Falls, SD-MN Metro Area","1,961"
"Slidell-Mandeville-Covington, LA Metro Area","2,472"
"South Bend-Mishawaka, IN-MI Metro Area","2,212"
"Spartanburg, SC Metro Area","1,691"
"Spokane-Spokane Valley, WA Metro Area","5,314"
"Springfield, IL Metro Area","6,327"
"Springfield, MA Metro Area","4,428"
"Springfield, MO Metro Area","3,544"
"Springfield, OH Metro Area","1,077"
"State College, PA Metro Area","940"
"Staunton-Stuarts Draft, VA Metro Area","1,209"
"Stockton-Lodi, CA Metro Area","8,835"
"Sumter, SC Metro Area","1,323"
"Syracuse, NY Metro Area","5,469"
"Tallahassee, FL Metro Area","14,866"
"Tampa-St. Petersburg-Clearwater, FL Metro Area","23,177"
"Terre Haute, IN Metro Area","2,063"
"Texarkana, TX-AR Metro Area","2,169"
"Toledo, OH Metro Area","4,171"
"Topeka, KS Metro Area","5,251"
"Traverse City, MI Metro Area","959"
"Trenton-Princeton, NJ Metro Area","6,298"
"Tucson, AZ Metro Area","10,206"
"Tulsa, OK Metro Area","8,693"
"Tuscaloosa, AL Metro Area","2,008"
"Twin Falls, ID Metro Area","990"
"Tyler, TX Metro Area","1,407"
"Urban Honolulu, HI Metro Area","17,566"
"Utica-Rome, NY Metro Area","3,677"
"Valdosta, GA Metro Area","2,005"
"Vallejo, CA Metro Area","7,702"
"Victoria, TX Metro Area","636"
"Vineland, NJ Metro Area","1,839"
"Virginia Beach-Chesapeake-Norfolk, VA-NC Metro Area","26,584"
"Visalia, CA Metro Area","5,362"
"Waco, TX Metro Area","3,015"
"Walla Walla, WA Metro Area","605"
"Warner Robins, GA Metro Area","4,637"
"Washington-Arlington-Alexandria, DC-VA-MD-WV Metro Area","203,947"
"Waterbury-Shelton, CT Metro Area","4,851"
"Waterloo-Cedar Falls, IA Metro Area","875"
"Watertown-Fort Drum, NY Metro Area","1,401"
"Wausau, WI Metro Area","650"
"Weirton-Steubenville, WV-OH Metro Area","883"
"Wenatchee-East Wenatchee, WA Metro Area","859"
"Wheeling, WV-OH Metro Area","1,054"
"Wichita, KS Metro Area","5,276"
"Wichita Falls, TX Metro Area","1,588"
"Wildwood-The Villages, FL Metro Area","573"
"Williamsport, PA Metro Area","886"
"Wilmington, NC Metro Area","3,344"
"Winchester, VA-WV Metro Area","1,899"
"Winston-Salem, NC Metro Area","4,365"
"Worcester, MA Metro Area","6,765"
"Yakima, WA Metro Area","2,816"
"York-Hanover, PA Metro Area","4,231"
"Youngstown-Warren, OH Metro Area","2,880"
"Yuba City, CA Metro Area","2,575"
"Yuma, AZ Metro Area","2,459"