"Region","In labor force:","MoE"
"Abilene, TX Metro Area","87,084","± 1,360"
"Aguadilla, PR Metro Area","88,143","± 2,017"
"Akron, OH Metro Area","372,765","± 2,617"
"Albany, GA Metro Area","66,396","± 1,192"
"Albany, OR Metro Area","62,540","± 1,053"
"Albany-Schenectady-Troy, NY Metro Area","480,117","± 2,559"
"Albuquerque, NM Metro Area","457,524","± 3,052"
"Alexandria, LA Metro Area","66,437","± 1,397"
"Allentown-Bethlehem-Easton, PA-NJ Metro Area","453,503","± 2,812"
"Altoona, PA Metro Area","59,231","± 1,100"
"Amarillo, TX Metro Area","131,577","± 1,570"
"Ames, IA Metro Area","69,828","± 1,096"
"Amherst Town-Northampton, MA Metro Area","84,172","± 1,307"
"Anchorage, AK Metro Area","210,132","± 2,538"
"Ann Arbor, MI Metro Area","196,143","± 2,031"
"Anniston-Oxford, AL Metro Area","52,679","± 1,021"
"Appleton, WI Metro Area","135,640","± 1,306"
"Arecibo, PR Metro Area","66,356","± 1,684"
"Asheville, NC Metro Area","202,754","± 2,249"
"Athens-Clarke County, GA Metro Area","111,298","± 1,537"
"Atlanta-Sandy Springs-Roswell, GA Metro Area","3,293,972","± 10,382"
"Atlantic City-Hammonton, NJ Metro Area","188,605","± 2,077"
"Auburn-Opelika, AL Metro Area","95,279","± 1,842"
"Augusta-Richmond County, GA-SC Metro Area","299,265","± 3,140"
"Austin-Round Rock-San Marcos, TX Metro Area","1,351,165","± 6,411"
"Bakersfield-Delano, CA Metro Area","398,143","± 3,164"
"Baltimore-Columbia-Towson, MD Metro Area","1,521,759","± 5,134"
"Bangor, ME Metro Area","77,964","± 1,041"
"Barnstable Town, MA Metro Area","119,509","± 1,598"
"Baton Rouge, LA Metro Area","430,683","± 3,659"
"Battle Creek, MI Metro Area","63,490","± 833"
"Bay City, MI Metro Area","50,494","± 848"
"Beaumont-Port Arthur, TX Metro Area","176,766","± 2,140"
"Beckley, WV Metro Area","44,583","± 1,513"
"Bellingham, WA Metro Area","119,729","± 1,615"
"Bend, OR Metro Area","129,804","± 1,757"
"Billings, MT Metro Area","98,092","± 1,434"
"Binghamton, NY Metro Area","116,204","± 1,622"
"Birmingham, AL Metro Area","573,684","± 4,293"
"Bismarck, ND Metro Area","71,947","± 1,048"
"Blacksburg-Christiansburg-Radford, VA Metro Area","89,152","± 1,473"
"Bloomington, IL Metro Area","89,043","± 1,461"
"Bloomington, IN Metro Area","84,708","± 1,152"
"Boise City, ID Metro Area","407,519","± 2,919"
"Boston-Cambridge-Newton, MA-NH Metro Area","2,813,361","± 6,605"
"Boulder, CO Metro Area","186,330","± 1,653"
"Bowling Green, KY Metro Area","92,587","± 1,255"
"Bozeman, MT Metro Area","72,089","± 1,105"
"Bremerton-Silverdale-Port Orchard, WA Metro Area","140,784","± 1,163"
"Bridgeport-Stamford-Danbury, CT Metro Area","517,610","± 2,872"
"Brownsville-Harlingen, TX Metro Area","182,920","± 2,115"
"Brunswick-St. Simons, GA Metro Area","51,000","± 1,521"
"Buffalo-Cheektowaga, NY Metro Area","595,728","± 3,208"
"Burlington, NC Metro Area","88,227","± 1,190"
"Burlington-South Burlington, VT Metro Area","130,514","± 1,453"
"Canton-Massillon, OH Metro Area","199,180","± 1,832"
"Cape Coral-Fort Myers, FL Metro Area","357,508","± 3,324"
"Cape Girardeau, MO-IL Metro Area","50,320","± 819"
"Carson City, NV Metro Area","28,498","± 649"
"Casper, WY Metro Area","41,886","± 821"
"Cedar Rapids, IA Metro Area","148,867","± 1,532"
"Chambersburg, PA Metro Area","77,950","± 1,086"
"Champaign-Urbana, IL Metro Area","120,052","± 1,726"
"Charleston, WV Metro Area","92,358","± 1,487"
"Charleston-North Charleston, SC Metro Area","433,884","± 3,072"
"Charlotte-Concord-Gastonia, NC-SC Metro Area","1,453,505","± 5,306"
"Charlottesville, VA Metro Area","115,717","± 1,424"
"Chattanooga, TN-GA Metro Area","286,440","± 2,644"
"Cheyenne, WY Metro Area","53,186","± 904"
"Chicago-Naperville-Elgin, IL-IN Metro Area","5,029,330","± 10,400"
"Chico, CA Metro Area","101,323","± 1,427"
"Cincinnati, OH-KY-IN Metro Area","1,176,338","± 4,513"
"Clarksville, TN-KY Metro Area","160,019","± 1,703"
"Cleveland, OH Metro Area","1,126,548","± 4,362"
"Cleveland, TN Metro Area","62,746","± 1,224"
"Coeur d'Alene, ID Metro Area","85,833","± 1,252"
"College Station-Bryan, TX Metro Area","138,791","± 1,663"
"Colorado Springs, CO Metro Area","413,194","± 2,561"
"Columbia, MO Metro Area","113,836","± 1,356"
"Columbia, SC Metro Area","431,616","± 2,887"
"Columbus, GA-AL Metro Area","152,169","± 1,863"
"Columbus, IN Metro Area","43,023","± 806"
"Columbus, OH Metro Area","1,154,734","± 4,386"
"Corpus Christi, TX Metro Area","212,269","± 2,243"
"Corvallis, OR Metro Area","50,582","± 1,214"
"Crestview-Fort Walton Beach-Destin, FL Metro Area","149,561","± 1,854"
"Dallas-Fort Worth-Arlington, TX Metro Area","4,197,245","± 9,574"
"Dalton, GA Metro Area","70,310","± 1,196"
"Daphne-Fairhope-Foley, AL Metro Area","113,778","± 1,904"
"Davenport-Moline-Rock Island, IA-IL Metro Area","193,527","± 1,465"
"Dayton-Kettering-Beavercreek, OH Metro Area","413,243","± 2,895"
"Decatur, AL Metro Area","72,063","± 1,311"
"Decatur, IL Metro Area","47,275","± 961"
"Deltona-Daytona Beach-Ormond Beach, FL Metro Area","313,067","± 3,076"
"Denver-Aurora-Centennial, CO Metro Area","1,733,953","± 4,371"
"Des Moines-West Des Moines, IA Metro Area","399,419","± 2,673"
"Detroit-Warren-Dearborn, MI Metro Area","2,210,120","± 6,343"
"Dothan, AL Metro Area","68,377","± 1,000"
"Dover, DE Metro Area","91,582","± 1,295"
"Dubuque, IA Metro Area","53,604","± 837"
"Duluth, MN-WI Metro Area","143,185","± 1,080"
"Durham-Chapel Hill, NC Metro Area","315,380","± 2,340"
"Eagle Pass, TX Metro Area","24,307","± 786"
"Eau Claire, WI Metro Area","94,271","± 989"
"El Centro, CA Metro Area","70,525","± 1,639"
"Elizabethtown, KY Metro Area","61,762","± 1,029"
"Elkhart-Goshen, IN Metro Area","101,598","± 1,468"
"Elmira, NY Metro Area","39,066","± 761"
"El Paso, TX Metro Area","416,527","± 3,770"
"Enid, OK Metro Area","30,967","± 678"
"Erie, PA Metro Area","129,837","± 1,433"
"Eugene-Springfield, OR Metro Area","195,429","± 2,499"
"Evansville, IN Metro Area","139,024","± 1,393"
"Fairbanks-College, AK Metro Area","51,348","± 1,914"
"Fargo, ND-MN Metro Area","150,844","± 1,391"
"Farmington, NM Metro Area","50,137","± 1,143"
"Fayetteville, NC Metro Area","192,637","± 1,451"
"Fayetteville-Springdale-Rogers, AR Metro Area","288,942","± 2,621"
"Flagstaff, AZ Metro Area","73,479","± 1,130"
"Flint, MI Metro Area","189,049","± 2,120"
"Florence, SC Metro Area","91,539","± 1,295"
"Florence-Muscle Shoals, AL Metro Area","72,218","± 1,443"
"Fond du Lac, WI Metro Area","55,013","± 875"
"Fort Collins-Loveland, CO Metro Area","204,680","± 1,923"
"Fort Smith, AR-OK Metro Area","104,471","± 1,459"
"Fort Wayne, IN Metro Area","232,584","± 1,605"
"Fresno, CA Metro Area","534,504","± 3,558"
"Gadsden, AL Metro Area","46,161","± 1,072"
"Gainesville, FL Metro Area","167,457","± 2,642"
"Gainesville, GA Metro Area","104,194","± 1,271"
"Gettysburg, PA Metro Area","54,775","± 896"
"Glens Falls, NY Metro Area","63,524","± 934"
"Goldsboro, NC Metro Area","56,446","± 1,270"
"Grand Forks, ND-MN Metro Area","57,898","± 878"
"Grand Island, NE Metro Area","39,744","± 724"
"Grand Junction, CO Metro Area","78,746","± 1,299"
"Grand Rapids-Wyoming-Kentwood, MI Metro Area","613,094","± 2,981"
"Grants Pass, OR Metro Area","36,368","± 895"
"Great Falls, MT Metro Area","42,784","± 772"
"Greeley, CO Metro Area","183,330","± 1,457"
"Green Bay, WI Metro Area","177,093","± 1,536"
"Greensboro-High Point, NC Metro Area","393,623","± 3,383"
"Greenville, NC Metro Area","88,255","± 1,377"
"Greenville-Anderson-Greer, SC Metro Area","474,062","± 3,275"
"Guayama, PR Metro Area","20,436","± 976"
"Gulfport-Biloxi, MS Metro Area","200,452","± 2,147"
"Hagerstown-Martinsburg, MD-WV Metro Area","150,456","± 1,564"
"Hammond, LA Metro Area","61,896","± 1,590"
"Hanford-Corcoran, CA Metro Area","64,752","± 1,244"
"Harrisburg-Carlisle, PA Metro Area","311,228","± 2,038"
"Harrisonburg, VA Metro Area","70,181","± 1,036"
"Hartford-West Hartford-East Hartford, CT Metro Area","622,817","± 3,375"
"Hattiesburg, MS Metro Area","76,389","± 1,463"
"Helena, MT Metro Area","47,182","± 913"
"Hickory-Lenoir-Morganton, NC Metro Area","178,191","± 2,185"
"Hilton Head Island-Bluffton-Port Royal, SC Metro Area","104,442","± 1,599"
"Hinesville, GA Metro Area","40,891","± 764"
"Homosassa Springs, FL Metro Area","54,900","± 1,498"
"Hot Springs, AR Metro Area","45,255","± 1,035"
"Houma-Bayou Cane-Thibodaux, LA Metro Area","93,043","± 1,898"
"Houston-Pasadena-The Woodlands, TX Metro Area","3,717,377","± 10,078"
"Huntington-Ashland, WV-KY-OH Metro Area","162,244","± 1,827"
"Huntsville, AL Metro Area","258,924","± 2,541"
"Idaho Falls, ID Metro Area","76,947","± 1,025"
"Indianapolis-Carmel-Greenwood, IN Metro Area","1,117,994","± 4,694"
"Iowa City, IA Metro Area","101,354","± 1,258"
"Ithaca, NY Metro Area","52,190","± 1,091"
"Jackson, MI Metro Area","73,860","± 1,033"
"Jackson, MS Metro Area","292,452","± 2,993"
"Jackson, TN Metro Area","85,733","± 1,143"
"Jacksonville, FL Metro Area","838,217","± 4,865"
"Jacksonville, NC Metro Area","114,025","± 1,681"
"Janesville-Beloit, WI Metro Area","85,650","± 923"
"Jefferson City, MO Metro Area","73,811","± 955"
"Johnson City, TN Metro Area","100,466","± 1,558"
"Johnstown, PA Metro Area","60,005","± 770"
"Jonesboro, AR Metro Area","64,675","± 1,257"
"Joplin, MO-KS Metro Area","98,424","± 1,330"
"Kahului-Wailuku, HI Metro Area","86,245","± 1,234"
"Kalamazoo-Portage, MI Metro Area","140,052","± 1,542"
"Kankakee, IL Metro Area","52,653","± 949"
"Kansas City, MO-KS Metro Area","1,183,289","± 3,659"
"Kennewick-Richland, WA Metro Area","147,329","± 1,606"
"Kenosha, WI Metro Area","91,245","± 1,164"
"Killeen-Temple, TX Metro Area","235,362","± 2,013"
"Kingsport-Bristol, TN-VA Metro Area","139,814","± 1,662"
"Kingston, NY Metro Area","90,686","± 1,469"
"Kiryas Joel-Poughkeepsie-Newburgh, NY Metro Area","356,172","± 2,738"
"Knoxville, TN Metro Area","456,084","± 3,067"
"Kokomo, IN Metro Area","39,658","± 942"
"La Crosse-Onalaska, WI-MN Metro Area","90,279","± 943"
"Lafayette, LA Metro Area","198,653","± 2,418"
"Lafayette-West Lafayette, IN Metro Area","114,852","± 1,640"
"Lake Charles, LA Metro Area","113,566","± 1,897"
"Lake Havasu City-Kingman, AZ Metro Area","81,736","± 1,492"
"Lakeland-Winter Haven, FL Metro Area","349,469","± 2,687"
"Lancaster, PA Metro Area","289,905","± 2,082"
"Lansing-East Lansing, MI Metro Area","247,911","± 2,034"
"Laredo, TX Metro Area","119,866","± 1,634"
"Las Cruces, NM Metro Area","101,766","± 1,628"
"Las Vegas-Henderson-North Las Vegas, NV Metro Area","1,169,319","± 4,687"
"Lawrence, KS Metro Area","69,840","± 925"
"Lawton, OK Metro Area","60,507","± 984"
"Lebanon, PA Metro Area","72,115","± 970"
"Lewiston, ID-WA Metro Area","31,044","± 827"
"Lewiston-Auburn, ME Metro Area","58,716","± 884"
"Lexington-Fayette, KY Metro Area","276,109","± 2,027"
"Lexington Park, MD Metro Area","112,064","± 1,374"
"Lima, OH Metro Area","49,025","± 868"
"Lincoln, NE Metro Area","190,430","± 1,428"
"Little Rock-North Little Rock-Conway, AR Metro Area","371,700","± 3,291"
"Logan, UT-ID Metro Area","77,538","± 926"
"Longview, TX Metro Area","133,864","± 1,689"
"Longview-Kelso, WA Metro Area","49,326","± 1,032"
"Los Angeles-Long Beach-Anaheim, CA Metro Area","6,897,043","± 12,563"
"Louisville/Jefferson County, KY-IN Metro Area","708,762","± 3,472"
"Lubbock, TX Metro Area","181,447","± 2,084"
"Lynchburg, VA Metro Area","128,589","± 1,583"
"Macon-Bibb County, GA Metro Area","106,190","± 1,914"
"Madison, WI Metro Area","392,578","± 2,638"
"Manchester-Nashua, NH Metro Area","247,754","± 1,688"
"Manhattan, KS Metro Area","74,529","± 1,115"
"Mankato, MN Metro Area","59,041","± 793"
"Mansfield, OH Metro Area","57,305","± 1,103"
"Mayagüez, PR Metro Area","76,394","± 1,707"
"McAllen-Edinburg-Mission, TX Metro Area","373,505","± 2,975"
"Medford, OR Metro Area","104,635","± 1,544"
"Memphis, TN-MS-AR Metro Area","669,098","± 4,137"
"Merced, CA Metro Area","125,225","± 1,652"
"Miami-Fort Lauderdale-West Palm Beach, FL Metro Area","3,217,050","± 9,344"
"Michigan City-La Porte, IN Metro Area","51,946","± 865"
"Midland, MI Metro Area","40,362","± 771"
"Midland, TX Metro Area","91,706","± 1,612"
"Milwaukee-Waukesha, WI Metro Area","824,744","± 3,446"
"Minneapolis-St. Paul-Bloomington, MN-WI Metro Area","2,072,937","± 5,221"
"Minot, ND Metro Area","42,957","± 745"
"Missoula, MT Metro Area","71,962","± 911"
"Mobile, AL Metro Area","190,120","± 1,827"
"Modesto, CA Metro Area","260,721","± 2,461"
"Monroe, LA Metro Area","99,994","± 1,514"
"Monroe, MI Metro Area","75,403","± 1,340"
"Montgomery, AL Metro Area","180,587","± 2,102"
"Morgantown, WV Metro Area","71,982","± 1,260"
"Morristown, TN Metro Area","57,234","± 1,446"
"Mount Vernon-Anacortes, WA Metro Area","62,218","± 912"
"Muncie, IN Metro Area","56,132","± 1,090"
"Muskegon-Norton Shores, MI Metro Area","83,281","± 1,113"
"Myrtle Beach-Conway-North Myrtle Beach, SC Metro Area","169,496","± 2,337"
"Napa, CA Metro Area","71,753","± 1,008"
"Naples-Marco Island, FL Metro Area","170,431","± 2,483"
"Nashville-Davidson--Murfreesboro--Franklin, TN Metro Area","1,117,719","± 4,776"
"New Haven, CT Metro Area","305,961","± 2,119"
"New Orleans-Metairie, LA Metro Area","497,269","± 3,617"
"New York-Newark-Jersey City, NY-NJ Metro Area","10,421,502","± 15,437"
"Niles, MI Metro Area","75,067","± 1,186"
"North Port-Bradenton-Sarasota, FL Metro Area","383,219","± 3,160"
"Norwich-New London-Willimantic, CT Metro Area","148,942","± 1,456"
"Ocala, FL Metro Area","156,378","± 2,394"
"Odessa, TX Metro Area","80,100","± 1,457"
"Ogden, UT Metro Area","336,707","± 2,301"
"Oklahoma City, OK Metro Area","738,321","± 4,006"
"Olympia-Lacey-Tumwater, WA Metro Area","149,449","± 1,794"
"Omaha, NE-IA Metro Area","528,668","± 2,259"
"Orlando-Kissimmee-Sanford, FL Metro Area","1,435,830","± 6,575"
"Oshkosh-Neenah, WI Metro Area","93,273","± 1,039"
"Owensboro, KY Metro Area","54,004","± 989"
"Oxnard-Thousand Oaks-Ventura, CA Metro Area","435,509","± 2,962"
"Paducah, KY-IL Metro Area","47,194","± 884"
"Palm Bay-Melbourne-Titusville, FL Metro Area","296,060","± 2,475"
"Panama City-Panama City Beach, FL Metro Area","102,415","± 1,223"
"Parkersburg-Vienna, WV Metro Area","39,953","± 876"
"Pensacola-Ferry Pass-Brent, FL Metro Area","255,086","± 2,188"
"Peoria, IL Metro Area","180,188","± 1,369"
"Philadelphia-Camden-Wilmington, PA-NJ-DE-MD Metro Area","3,329,656","± 7,882"
"Phoenix-Mesa-Chandler, AZ Metro Area","2,522,869","± 6,980"
"Pinehurst-Southern Pines, NC Metro Area","47,473","± 1,080"
"Pittsburgh, PA Metro Area","1,275,756","± 4,843"
"Pittsfield, MA Metro Area","66,944","± 1,048"
"Pocatello, ID Metro Area","42,553","± 851"
"Ponce, PR Metro Area","94,132","± 1,787"
"Portland-South Portland, ME Metro Area","313,027","± 2,495"
"Portland-Vancouver-Hillsboro, OR-WA Metro Area","1,368,012","± 4,777"
"Port St. Lucie, FL Metro Area","233,236","± 2,674"
"Prescott Valley-Prescott, AZ Metro Area","101,040","± 1,794"
"Providence-Warwick, RI-MA Metro Area","902,590","± 4,757"
"Provo-Orem-Lehi, UT Metro Area","356,552","± 2,009"
"Pueblo, CO Metro Area","75,684","± 1,316"
"Punta Gorda, FL Metro Area","74,605","± 1,524"
"Racine-Mount Pleasant, WI Metro Area","100,491","± 1,087"
"Raleigh-Cary, NC Metro Area","791,256","± 3,727"
"Rapid City, SD Metro Area","79,180","± 1,039"
"Reading, PA Metro Area","223,580","± 1,891"
"Redding, CA Metro Area","82,033","± 1,434"
"Reno, NV Metro Area","294,013","± 2,136"
"Richmond, VA Metro Area","717,675","± 3,248"
"Riverside-San Bernardino-Ontario, CA Metro Area","2,223,053","± 6,343"
"Roanoke, VA Metro Area","154,251","± 1,610"
"Rochester, MN Metro Area","124,497","± 1,061"
"Rochester, NY Metro Area","544,918","± 2,884"
"Rockford, IL Metro Area","166,535","± 1,514"
"Rocky Mount, NC Metro Area","68,102","± 1,419"
"Rome, GA Metro Area","46,551","± 972"
"Sacramento-Roseville-Folsom, CA Metro Area","1,208,610","± 4,727"
"Saginaw, MI Metro Area","87,179","± 1,233"
"St. Cloud, MN Metro Area","110,907","± 1,121"
"St. George, UT Metro Area","85,118","± 1,532"
"St. Joseph, MO-KS Metro Area","57,823","± 792"
"St. Louis, MO-IL Metro Area","1,478,780","± 5,092"
"Salem, OR Metro Area","211,558","± 1,968"
"Salinas, CA Metro Area","202,644","± 1,712"
"Salisbury, MD Metro Area","64,936","± 1,260"
"Salt Lake City-Murray, UT Metro Area","700,291","± 3,348"
"San Angelo, TX Metro Area","60,500","± 1,033"
"San Antonio-New Braunfels, TX Metro Area","1,332,751","± 5,420"
"San Diego-Chula Vista-Carlsbad, CA Metro Area","1,769,244","± 5,394"
"Sandusky, OH Metro Area","57,653","± 1,038"
"San Francisco-Oakland-Fremont, CA Metro Area","2,583,342","± 7,041"
"San Jose-Sunnyvale-Santa Clara, CA Metro Area","1,081,406","± 3,660"
"San Juan-Bayamón-Caguas, PR Metro Area","853,590","± 4,551"
"San Luis Obispo-Paso Robles, CA Metro Area","139,458","± 1,992"
"Santa Cruz-Watsonville, CA Metro Area","141,170","± 1,620"
"Santa Fe, NM Metro Area","76,447","± 1,241"
"Santa Maria-Santa Barbara, CA Metro Area","223,178","± 1,992"
"Santa Rosa-Petaluma, CA Metro Area","260,365","± 2,175"
"Savannah, GA Metro Area","213,286","± 2,045"
"Scranton--Wilkes-Barre, PA Metro Area","281,898","± 2,369"
"Seattle-Tacoma-Bellevue, WA Metro Area","2,243,158","± 6,019"
"Sebastian-Vero Beach-West Vero Corridor, FL Metro Area","69,495","± 1,565"
"Sebring, FL Metro Area","38,027","± 1,058"
"Sheboygan, WI Metro Area","62,322","± 880"
"Sherman-Denison, TX Metro Area","68,765","± 1,139"
"Shreveport-Bossier City, LA Metro Area","177,414","± 2,361"
"Sierra Vista-Douglas, AZ Metro Area","50,524","± 1,158"
"Sioux City, IA-NE-SD Metro Area","75,221","± 895"
"Sioux Falls, SD-MN Metro Area","167,240","± 1,346"
"Slidell-Mandeville-Covington, LA Metro Area","133,532","± 2,236"
"South Bend-Mishawaka, IN-MI Metro Area","161,585","± 1,460"
"Spartanburg, SC Metro Area","177,899","± 1,842"
"Spokane-Spokane Valley, WA Metro Area","290,365","± 2,164"
"Springfield, IL Metro Area","102,968","± 1,235"
"Springfield, MA Metro Area","229,081","± 2,439"
"Springfield, MO Metro Area","239,214","± 1,901"
"Springfield, OH Metro Area","64,185","± 1,032"
"State College, PA Metro Area","77,003","± 1,359"
"Staunton-Stuarts Draft, VA Metro Area","63,740","± 1,051"
"Stockton-Lodi, CA Metro Area","372,892","± 2,610"
"Sumter, SC Metro Area","48,255","± 1,058"
"Syracuse, NY Metro Area","331,767","± 2,535"
"Tallahassee, FL Metro Area","200,756","± 2,327"
"Tampa-St. Petersburg-Clearwater, FL Metro Area","1,636,363","± 5,181"
"Terre Haute, IN Metro Area","79,882","± 1,269"
"Texarkana, TX-AR Metro Area","63,226","± 1,226"
"Toledo, OH Metro Area","309,598","± 2,316"
"Topeka, KS Metro Area","116,103","± 1,395"
"Traverse City, MI Metro Area","77,546","± 859"
"Trenton-Princeton, NJ Metro Area","198,572","± 2,057"
"Tucson, AZ Metro Area","505,103","± 3,554"
"Tulsa, OK Metro Area","511,915","± 2,245"
"Tuscaloosa, AL Metro Area","133,178","± 2,069"
"Twin Falls, ID Metro Area","56,710","± 943"
"Tyler, TX Metro Area","114,428","± 1,569"
"Urban Honolulu, HI Metro Area","534,096","± 2,987"
"Utica-Rome, NY Metro Area","136,793","± 1,609"
"Valdosta, GA Metro Area","70,322","± 1,426"
"Vallejo, CA Metro Area","226,789","± 1,999"
"Victoria, TX Metro Area","46,822","± 887"
"Vineland, NJ Metro Area","68,571","± 1,112"
"Virginia Beach-Chesapeake-Norfolk, VA-NC Metro Area","955,277","± 3,549"
"Visalia, CA Metro Area","211,707","± 2,583"
"Waco, TX Metro Area","142,819","± 1,610"
"Walla Walla, WA Metro Area","30,006","± 709"
"Warner Robins, GA Metro Area","97,790","± 1,693"
"Washington-Arlington-Alexandria, DC-VA-MD-WV Metro Area","3,550,154","± 6,942"
"Waterbury-Shelton, CT Metro Area","243,823","± 2,257"
"Waterloo-Cedar Falls, IA Metro Area","89,594","± 1,112"
"Watertown-Fort Drum, NY Metro Area","58,621","± 788"
"Wausau, WI Metro Area","74,270","± 692"
"Weirton-Steubenville, WV-OH Metro Area","53,960","± 1,094"
"Wenatchee-East Wenatchee, WA Metro Area","60,410","± 1,121"
"Wheeling, WV-OH Metro Area","63,796","± 883"
"Wichita, KS Metro Area","330,570","± 2,649"
"Wichita Falls, TX Metro Area","75,258","± 1,349"
"Wildwood-The Villages, FL Metro Area","32,419","± 1,188"
"Williamsport, PA Metro Area","55,677","± 809"
"Wilmington, NC Metro Area","219,162","± 2,074"
"Winchester, VA-WV Metro Area","73,125","± 1,242"
"Winston-Salem, NC Metro Area","333,712","± 2,997"
"Worcester, MA Metro Area","469,112","± 2,924"
"Yakima, WA Metro Area","118,749","± 1,659"
"York-Hanover, PA Metro Area","243,804","± 1,783"
"Youngstown-Warren, OH Metro Area","200,874","± 1,845"
"Yuba City, CA Metro Area","83,448","± 1,351"
"Yuma, AZ Metro Area","86,787","± 1,332"