"Region","Total:","MoE"
"Abilene, TX Metro Area","79,704","± 1,350"
"Aguadilla, PR Metro Area","77,598","± 2,220"
"Akron, OH Metro Area","352,709","± 2,569"
"Albany, GA Metro Area","60,581","± 1,308"
"Albany, OR Metro Area","58,767","± 1,046"
"Albany-Schenectady-Troy, NY Metro Area","455,608","± 2,614"
"Albuquerque, NM Metro Area","428,298","± 2,951"
"Alexandria, LA Metro Area","62,667","± 1,450"
"Allentown-Bethlehem-Easton, PA-NJ Metro Area","428,874","± 2,856"
"Altoona, PA Metro Area","56,533","± 1,080"
"Amarillo, TX Metro Area","126,873","± 1,530"
"Ames, IA Metro Area","66,717","± 1,277"
"Amherst Town-Northampton, MA Metro Area","79,837","± 1,277"
"Anchorage, AK Metro Area","189,255","± 7,553"
"Ann Arbor, MI Metro Area","187,381","± 2,054"
"Anniston-Oxford, AL Metro Area","48,859","± 972"
"Appleton, WI Metro Area","131,767","± 1,312"
"Arecibo, PR Metro Area","58,929","± 1,684"
"Asheville, NC Metro Area","195,538","± 2,434"
"Athens-Clarke County, GA Metro Area","105,955","± 1,616"
"Atlanta-Sandy Springs-Roswell, GA Metro Area","3,123,977","± 10,872"
"Atlantic City-Hammonton, NJ Metro Area","173,038","± 2,175"
"Auburn-Opelika, AL Metro Area","90,436","± 1,840"
"Augusta-Richmond County, GA-SC Metro Area","270,385","± 3,250"
"Austin-Round Rock-San Marcos, TX Metro Area","1,290,400","± 6,834"
"Bakersfield-Delano, CA Metro Area","362,655","± 3,723"
"Baltimore-Columbia-Towson, MD Metro Area","1,434,072","± 5,528"
"Bangor, ME Metro Area","74,573","± 1,069"
"Barnstable Town, MA Metro Area","113,261","± 1,598"
"Baton Rouge, LA Metro Area","401,569","± 4,117"
"Battle Creek, MI Metro Area","58,971","± 900"
"Bay City, MI Metro Area","48,149","± 918"
"Beaumont-Port Arthur, TX Metro Area","166,237","± 2,198"
"Beckley, WV Metro Area","41,753","± 1,605"
"Bellingham, WA Metro Area","113,292","± 1,566"
"Bend, OR Metro Area","123,144","± 1,907"
"Billings, MT Metro Area","94,576","± 1,484"
"Binghamton, NY Metro Area","108,752","± 1,580"
"Birmingham, AL Metro Area","546,581","± 4,372"
"Bismarck, ND Metro Area","69,702","± 1,102"
"Blacksburg-Christiansburg-Radford, VA Metro Area","85,554","± 1,580"
"Bloomington, IL Metro Area","86,270","± 1,455"
"Bloomington, IN Metro Area","80,039","± 1,284"
"Boise City, ID Metro Area","393,380","± 2,794"
"Boston-Cambridge-Newton, MA-NH Metro Area","2,673,516","± 7,021"
"Boulder, CO Metro Area","177,426","± 1,717"
"Bowling Green, KY Metro Area","87,886","± 1,380"
"Bozeman, MT Metro Area","70,355","± 1,110"
"Bremerton-Silverdale-Port Orchard, WA Metro Area","121,151","± 1,499"
"Bridgeport-Stamford-Danbury, CT Metro Area","485,624","± 3,610"
"Brownsville-Harlingen, TX Metro Area","172,143","± 2,074"
"Brunswick-St. Simons, GA Metro Area","48,723","± 1,444"
"Buffalo-Cheektowaga, NY Metro Area","564,976","± 3,409"
"Burlington, NC Metro Area","83,828","± 1,169"
"Burlington-South Burlington, VT Metro Area","125,354","± 1,478"
"Canton-Massillon, OH Metro Area","191,301","± 1,913"
"Cape Coral-Fort Myers, FL Metro Area","342,267","± 3,572"
"Cape Girardeau, MO-IL Metro Area","48,585","± 906"
"Carson City, NV Metro Area","27,220","± 619"
"Casper, WY Metro Area","40,237","± 861"
"Cedar Rapids, IA Metro Area","143,571","± 1,787"
"Chambersburg, PA Metro Area","75,094","± 1,202"
"Champaign-Urbana, IL Metro Area","114,410","± 1,730"
"Charleston, WV Metro Area","86,279","± 1,587"
"Charleston-North Charleston, SC Metro Area","405,245","± 3,343"
"Charlotte-Concord-Gastonia, NC-SC Metro Area","1,385,603","± 5,902"
"Charlottesville, VA Metro Area","110,966","± 1,539"
"Chattanooga, TN-GA Metro Area","273,551","± 2,786"
"Cheyenne, WY Metro Area","48,612","± 942"
"Chicago-Naperville-Elgin, IL-IN Metro Area","4,711,018","± 10,494"
"Chico, CA Metro Area","93,949","± 1,509"
"Cincinnati, OH-KY-IN Metro Area","1,124,225","± 4,646"
"Clarksville, TN-KY Metro Area","132,152","± 2,122"
"Cleveland, OH Metro Area","1,060,356","± 4,550"
"Cleveland, TN Metro Area","59,133","± 1,268"
"Coeur d'Alene, ID Metro Area","82,964","± 1,315"
"College Station-Bryan, TX Metro Area","131,942","± 1,757"
"Colorado Springs, CO Metro Area","357,894","± 3,067"
"Columbia, MO Metro Area","109,294","± 1,449"
"Columbia, SC Metro Area","397,263","± 3,239"
"Columbus, GA-AL Metro Area","129,791","± 1,897"
"Columbus, IN Metro Area","41,316","± 871"
"Columbus, OH Metro Area","1,105,666","± 4,774"
"Corpus Christi, TX Metro Area","198,442","± 2,535"
"Corvallis, OR Metro Area","47,156","± 1,207"
"Crestview-Fort Walton Beach-Destin, FL Metro Area","131,370","± 1,957"
"Dallas-Fort Worth-Arlington, TX Metro Area","4,000,995","± 10,491"
"Dalton, GA Metro Area","66,534","± 1,330"
"Daphne-Fairhope-Foley, AL Metro Area","109,556","± 1,998"
"Davenport-Moline-Rock Island, IA-IL Metro Area","184,364","± 1,519"
"Dayton-Kettering-Beavercreek, OH Metro Area","387,011","± 3,242"
"Decatur, AL Metro Area","69,434","± 1,377"
"Decatur, IL Metro Area","43,884","± 1,025"
"Deltona-Daytona Beach-Ormond Beach, FL Metro Area","299,930","± 3,084"
"Denver-Aurora-Centennial, CO Metro Area","1,654,202","± 5,185"
"Des Moines-West Des Moines, IA Metro Area","382,003","± 2,800"
"Detroit-Warren-Dearborn, MI Metro Area","2,065,420","± 6,886"
"Dothan, AL Metro Area","64,951","± 978"
"Dover, DE Metro Area","84,137","± 1,436"
"Dubuque, IA Metro Area","51,563","± 951"
"Duluth, MN-WI Metro Area","136,562","± 1,122"
"Durham-Chapel Hill, NC Metro Area","302,497","± 2,502"
"Eagle Pass, TX Metro Area","22,428","± 835"
"Eau Claire, WI Metro Area","91,333","± 1,103"
"El Centro, CA Metro Area","61,339","± 1,592"
"Elizabethtown, KY Metro Area","54,476","± 1,048"
"Elkhart-Goshen, IN Metro Area","98,106","± 1,503"
"Elmira, NY Metro Area","36,535","± 745"
"El Paso, TX Metro Area","372,932","± 3,966"
"Enid, OK Metro Area","28,340","± 724"
"Erie, PA Metro Area","122,520","± 1,454"
"Eugene-Springfield, OR Metro Area","181,926","± 2,408"
"Evansville, IN Metro Area","133,599","± 1,449"
"Fairbanks-College, AK Metro Area","40,873","± 3,544"
"Fargo, ND-MN Metro Area","145,213","± 1,507"
"Farmington, NM Metro Area","46,212","± 1,241"
"Fayetteville, NC Metro Area","144,391","± 1,806"
"Fayetteville-Springdale-Rogers, AR Metro Area","278,140","± 2,753"
"Flagstaff, AZ Metro Area","68,549","± 1,184"
"Flint, MI Metro Area","173,265","± 2,252"
"Florence, SC Metro Area","86,017","± 1,376"
"Florence-Muscle Shoals, AL Metro Area","69,463","± 1,482"
"Fond du Lac, WI Metro Area","53,313","± 911"
"Fort Collins-Loveland, CO Metro Area","194,799","± 2,008"
"Fort Smith, AR-OK Metro Area","97,985","± 1,483"
"Fort Wayne, IN Metro Area","221,978","± 1,576"
"Fresno, CA Metro Area","485,852","± 4,007"
"Gadsden, AL Metro Area","43,234","± 1,274"
"Gainesville, FL Metro Area","160,279","± 2,504"
"Gainesville, GA Metro Area","99,845","± 1,429"
"Gettysburg, PA Metro Area","53,027","± 914"
"Glens Falls, NY Metro Area","60,536","± 977"
"Goldsboro, NC Metro Area","49,904","± 1,363"
"Grand Forks, ND-MN Metro Area","54,761","± 883"
"Grand Island, NE Metro Area","38,513","± 698"
"Grand Junction, CO Metro Area","74,658","± 1,492"
"Grand Rapids-Wyoming-Kentwood, MI Metro Area","587,379","± 3,333"
"Grants Pass, OR Metro Area","33,509","± 962"
"Great Falls, MT Metro Area","38,670","± 821"
"Greeley, CO Metro Area","174,373","± 1,498"
"Green Bay, WI Metro Area","172,344","± 1,515"
"Greensboro-High Point, NC Metro Area","374,159","± 3,721"
"Greenville, NC Metro Area","80,980","± 1,569"
"Greenville-Anderson-Greer, SC Metro Area","452,591","± 3,621"
"Guayama, PR Metro Area","18,765","± 1,023"
"Gulfport-Biloxi, MS Metro Area","179,029","± 2,139"
"Hagerstown-Martinsburg, MD-WV Metro Area","142,678","± 1,556"
"Hammond, LA Metro Area","58,376","± 1,637"
"Hanford-Corcoran, CA Metro Area","53,156","± 1,558"
"Harrisburg-Carlisle, PA Metro Area","297,919","± 2,299"
"Harrisonburg, VA Metro Area","66,937","± 1,132"
"Hartford-West Hartford-East Hartford, CT Metro Area","590,367","± 3,605"
"Hattiesburg, MS Metro Area","70,959","± 1,554"
"Helena, MT Metro Area","45,122","± 1,094"
"Hickory-Lenoir-Morganton, NC Metro Area","169,854","± 2,333"
"Hilton Head Island-Bluffton-Port Royal, SC Metro Area","93,990","± 1,749"
"Hinesville, GA Metro Area","30,290","± 1,028"
"Homosassa Springs, FL Metro Area","51,098","± 1,499"
"Hot Springs, AR Metro Area","42,590","± 1,138"
"Houma-Bayou Cane-Thibodaux, LA Metro Area","88,112","± 1,862"
"Houston-Pasadena-The Woodlands, TX Metro Area","3,490,021","± 10,071"
"Huntington-Ashland, WV-KY-OH Metro Area","153,677","± 1,958"
"Huntsville, AL Metro Area","248,290","± 2,507"
"Idaho Falls, ID Metro Area","73,983","± 1,094"
"Indianapolis-Carmel-Greenwood, IN Metro Area","1,069,712","± 5,146"
"Iowa City, IA Metro Area","97,611","± 1,215"
"Ithaca, NY Metro Area","49,388","± 1,001"
"Jackson, MI Metro Area","69,430","± 1,188"
"Jackson, MS Metro Area","274,479","± 3,008"
"Jackson, TN Metro Area","80,279","± 1,069"
"Jacksonville, FL Metro Area","783,495","± 5,156"
"Jacksonville, NC Metro Area","69,573","± 2,042"
"Janesville-Beloit, WI Metro Area","82,190","± 969"
"Jefferson City, MO Metro Area","70,938","± 986"
"Johnson City, TN Metro Area","94,869","± 1,611"
"Johnstown, PA Metro Area","57,010","± 828"
"Jonesboro, AR Metro Area","60,682","± 1,220"
"Joplin, MO-KS Metro Area","94,215","± 1,332"
"Kahului-Wailuku, HI Metro Area","80,960","± 1,386"
"Kalamazoo-Portage, MI Metro Area","131,924","± 1,576"
"Kankakee, IL Metro Area","49,969","± 1,012"
"Kansas City, MO-KS Metro Area","1,129,635","± 3,895"
"Kennewick-Richland, WA Metro Area","139,338","± 2,005"
"Kenosha, WI Metro Area","86,642","± 1,288"
"Killeen-Temple, TX Metro Area","189,559","± 2,799"
"Kingsport-Bristol, TN-VA Metro Area","131,467","± 1,791"
"Kingston, NY Metro Area","86,003","± 1,548"
"Kiryas Joel-Poughkeepsie-Newburgh, NY Metro Area","333,990","± 2,764"
"Knoxville, TN Metro Area","437,256","± 3,272"
"Kokomo, IN Metro Area","37,222","± 992"
"La Crosse-Onalaska, WI-MN Metro Area","87,476","± 1,029"
"Lafayette, LA Metro Area","187,193","± 2,571"
"Lafayette-West Lafayette, IN Metro Area","111,261","± 1,729"
"Lake Charles, LA Metro Area","107,301","± 2,004"
"Lake Havasu City-Kingman, AZ Metro Area","75,937","± 1,576"
"Lakeland-Winter Haven, FL Metro Area","333,548","± 2,635"
"Lancaster, PA Metro Area","280,073","± 2,106"
"Lansing-East Lansing, MI Metro Area","234,123","± 2,177"
"Laredo, TX Metro Area","113,106","± 1,688"
"Las Cruces, NM Metro Area","93,662","± 1,637"
"Las Vegas-Henderson-North Las Vegas, NV Metro Area","1,072,756","± 5,281"
"Lawrence, KS Metro Area","66,407","± 1,048"
"Lawton, OK Metro Area","47,575","± 977"
"Lebanon, PA Metro Area","68,711","± 1,043"
"Lewiston, ID-WA Metro Area","29,721","± 835"
"Lewiston-Auburn, ME Metro Area","56,173","± 848"
"Lexington-Fayette, KY Metro Area","263,041","± 2,366"
"Lexington Park, MD Metro Area","104,748","± 1,602"
"Lima, OH Metro Area","46,096","± 975"
"Lincoln, NE Metro Area","183,950","± 1,518"
"Little Rock-North Little Rock-Conway, AR Metro Area","350,682","± 3,732"
"Logan, UT-ID Metro Area","75,669","± 978"
"Longview, TX Metro Area","127,829","± 1,539"
"Longview-Kelso, WA Metro Area","46,763","± 1,054"
"Los Angeles-Long Beach-Anaheim, CA Metro Area","6,432,731","± 13,079"
"Louisville/Jefferson County, KY-IN Metro Area","675,733","± 3,416"
"Lubbock, TX Metro Area","172,393","± 2,204"
"Lynchburg, VA Metro Area","122,736","± 1,707"
"Macon-Bibb County, GA Metro Area","99,089","± 1,990"
"Madison, WI Metro Area","381,897","± 2,793"
"Manchester-Nashua, NH Metro Area","239,049","± 1,820"
"Manhattan, KS Metro Area","60,036","± 1,309"
"Mankato, MN Metro Area","57,004","± 824"
"Mansfield, OH Metro Area","54,386","± 1,164"
"Mayagüez, PR Metro Area","63,416","± 1,755"
"McAllen-Edinburg-Mission, TX Metro Area","344,351","± 3,576"
"Medford, OR Metro Area","98,844","± 1,584"
"Memphis, TN-MS-AR Metro Area","622,868","± 4,138"
"Merced, CA Metro Area","111,532","± 1,701"
"Miami-Fort Lauderdale-West Palm Beach, FL Metro Area","3,051,566","± 9,194"
"Michigan City-La Porte, IN Metro Area","49,621","± 947"
"Midland, MI Metro Area","38,346","± 804"
"Midland, TX Metro Area","87,985","± 1,595"
"Milwaukee-Waukesha, WI Metro Area","792,998","± 3,882"
"Minneapolis-St. Paul-Bloomington, MN-WI Metro Area","1,990,195","± 5,913"
"Minot, ND Metro Area","37,402","± 814"
"Missoula, MT Metro Area","68,572","± 1,030"
"Mobile, AL Metro Area","179,014","± 1,902"
"Modesto, CA Metro Area","240,228","± 2,488"
"Monroe, LA Metro Area","92,871","± 1,733"
"Monroe, MI Metro Area","71,545","± 1,426"
"Montgomery, AL Metro Area","167,816","± 2,261"
"Morgantown, WV Metro Area","68,068","± 1,273"
"Morristown, TN Metro Area","53,856","± 1,532"
"Mount Vernon-Anacortes, WA Metro Area","58,165","± 990"
"Muncie, IN Metro Area","52,649","± 981"
"Muskegon-Norton Shores, MI Metro Area","77,505","± 1,289"
"Myrtle Beach-Conway-North Myrtle Beach, SC Metro Area","160,429","± 2,380"
"Napa, CA Metro Area","68,069","± 1,100"
"Naples-Marco Island, FL Metro Area","163,506","± 2,678"
"Nashville-Davidson--Murfreesboro--Franklin, TN Metro Area","1,076,090","± 4,672"
"New Haven, CT Metro Area","287,656","± 2,398"
"New Orleans-Metairie, LA Metro Area","459,976","± 3,872"
"New York-Newark-Jersey City, NY-NJ Metro Area","9,731,475","± 18,202"
"Niles, MI Metro Area","70,170","± 1,323"
"North Port-Bradenton-Sarasota, FL Metro Area","365,668","± 3,242"
"Norwich-New London-Willimantic, CT Metro Area","135,498","± 1,719"
"Ocala, FL Metro Area","148,029","± 2,354"
"Odessa, TX Metro Area","75,536","± 1,584"
"Ogden, UT Metro Area","323,244","± 2,153"
"Oklahoma City, OK Metro Area","694,967","± 4,029"
"Olympia-Lacey-Tumwater, WA Metro Area","135,842","± 1,763"
"Omaha, NE-IA Metro Area","505,378","± 2,558"
"Orlando-Kissimmee-Sanford, FL Metro Area","1,359,780","± 6,086"
"Oshkosh-Neenah, WI Metro Area","91,076","± 1,021"
"Owensboro, KY Metro Area","51,425","± 1,018"
"Oxnard-Thousand Oaks-Ventura, CA Metro Area","407,470","± 2,955"
"Paducah, KY-IL Metro Area","45,564","± 915"
"Palm Bay-Melbourne-Titusville, FL Metro Area","279,335","± 2,771"
"Panama City-Panama City Beach, FL Metro Area","96,032","± 1,433"
"Parkersburg-Vienna, WV Metro Area","37,571","± 912"
"Pensacola-Ferry Pass-Brent, FL Metro Area","226,117","± 2,497"
"Peoria, IL Metro Area","170,599","± 1,484"
"Philadelphia-Camden-Wilmington, PA-NJ-DE-MD Metro Area","3,122,168","± 8,572"
"Phoenix-Mesa-Chandler, AZ Metro Area","2,396,814","± 7,129"
"Pinehurst-Southern Pines, NC Metro Area","41,485","± 1,344"
"Pittsburgh, PA Metro Area","1,210,525","± 5,042"
"Pittsfield, MA Metro Area","63,154","± 1,160"
"Pocatello, ID Metro Area","40,552","± 843"
"Ponce, PR Metro Area","80,161","± 1,844"
"Portland-South Portland, ME Metro Area","301,174","± 2,582"
"Portland-Vancouver-Hillsboro, OR-WA Metro Area","1,297,840","± 5,113"
"Port St. Lucie, FL Metro Area","220,264","± 2,949"
"Prescott Valley-Prescott, AZ Metro Area","96,693","± 1,910"
"Providence-Warwick, RI-MA Metro Area","847,292","± 5,452"
"Provo-Orem-Lehi, UT Metro Area","343,138","± 2,147"
"Pueblo, CO Metro Area","71,066","± 1,339"
"Punta Gorda, FL Metro Area","70,371","± 1,570"
"Racine-Mount Pleasant, WI Metro Area","96,127","± 1,219"
"Raleigh-Cary, NC Metro Area","756,731","± 4,085"
"Rapid City, SD Metro Area","73,935","± 1,260"
"Reading, PA Metro Area","211,518","± 1,962"
"Redding, CA Metro Area","76,845","± 1,534"
"Reno, NV Metro Area","277,950","± 2,324"
"Richmond, VA Metro Area","676,475","± 3,614"
"Riverside-San Bernardino-Ontario, CA Metro Area","2,051,577","± 7,614"
"Roanoke, VA Metro Area","147,885","± 1,915"
"Rochester, MN Metro Area","120,246","± 1,095"
"Rochester, NY Metro Area","518,225","± 2,945"
"Rockford, IL Metro Area","154,272","± 1,599"
"Rocky Mount, NC Metro Area","63,351","± 1,445"
"Rome, GA Metro Area","44,462","± 934"
"Sacramento-Roseville-Folsom, CA Metro Area","1,134,025","± 5,782"
"Saginaw, MI Metro Area","81,321","± 1,292"
"St. Cloud, MN Metro Area","105,910","± 1,168"
"St. George, UT Metro Area","82,248","± 1,500"
"St. Joseph, MO-KS Metro Area","55,097","± 927"
"St. Louis, MO-IL Metro Area","1,411,164","± 5,608"
"Salem, OR Metro Area","200,064","± 1,925"
"Salinas, CA Metro Area","186,050","± 1,895"
"Salisbury, MD Metro Area","60,714","± 1,385"
"Salt Lake City-Murray, UT Metro Area","673,516","± 3,653"
"San Angelo, TX Metro Area","56,084","± 1,130"
"San Antonio-New Braunfels, TX Metro Area","1,236,064","± 6,864"
"San Diego-Chula Vista-Carlsbad, CA Metro Area","1,576,445","± 6,400"
"Sandusky, OH Metro Area","54,673","± 1,034"
"San Francisco-Oakland-Fremont, CA Metro Area","2,440,853","± 7,216"
"San Jose-Sunnyvale-Santa Clara, CA Metro Area","1,031,473","± 4,223"
"San Juan-Bayamón-Caguas, PR Metro Area","753,443","± 4,618"
"San Luis Obispo-Paso Robles, CA Metro Area","131,629","± 1,921"
"Santa Cruz-Watsonville, CA Metro Area","133,217","± 1,666"
"Santa Fe, NM Metro Area","72,053","± 1,325"
"Santa Maria-Santa Barbara, CA Metro Area","206,977","± 2,255"
"Santa Rosa-Petaluma, CA Metro Area","246,077","± 2,547"
"Savannah, GA Metro Area","195,614","± 2,040"
"Scranton--Wilkes-Barre, PA Metro Area","266,598","± 2,422"
"Seattle-Tacoma-Bellevue, WA Metro Area","2,111,989","± 6,954"
"Sebastian-Vero Beach-West Vero Corridor, FL Metro Area","65,205","± 1,557"
"Sebring, FL Metro Area","35,736","± 1,140"
"Sheboygan, WI Metro Area","60,796","± 972"
"Sherman-Denison, TX Metro Area","66,269","± 1,255"
"Shreveport-Bossier City, LA Metro Area","159,332","± 2,396"
"Sierra Vista-Douglas, AZ Metro Area","43,088","± 1,307"
"Sioux City, IA-NE-SD Metro Area","71,863","± 912"
"Sioux Falls, SD-MN Metro Area","163,317","± 1,437"
"Slidell-Mandeville-Covington, LA Metro Area","125,648","± 2,234"
"South Bend-Mishawaka, IN-MI Metro Area","153,366","± 1,642"
"Spartanburg, SC Metro Area","169,590","± 1,828"
"Spokane-Spokane Valley, WA Metro Area","270,525","± 2,445"
"Springfield, IL Metro Area","97,074","± 1,324"
"Springfield, MA Metro Area","214,730","± 2,362"
"Springfield, MO Metro Area","230,116","± 2,079"
"Springfield, OH Metro Area","59,841","± 1,059"
"State College, PA Metro Area","73,733","± 1,362"
"Staunton-Stuarts Draft, VA Metro Area","61,301","± 1,111"
"Stockton-Lodi, CA Metro Area","345,069","± 2,893"
"Sumter, SC Metro Area","40,885","± 1,307"
"Syracuse, NY Metro Area","313,263","± 2,630"
"Tallahassee, FL Metro Area","189,569","± 2,581"
"Tampa-St. Petersburg-Clearwater, FL Metro Area","1,550,287","± 5,959"
"Terre Haute, IN Metro Area","75,105","± 1,318"
"Texarkana, TX-AR Metro Area","59,917","± 1,200"
"Toledo, OH Metro Area","290,342","± 2,472"
"Topeka, KS Metro Area","111,320","± 1,508"
"Traverse City, MI Metro Area","74,498","± 945"
"Trenton-Princeton, NJ Metro Area","186,085","± 2,144"
"Tucson, AZ Metro Area","468,800","± 3,810"
"Tulsa, OK Metro Area","484,163","± 2,471"
"Tuscaloosa, AL Metro Area","125,779","± 2,060"
"Twin Falls, ID Metro Area","54,752","± 1,023"
"Tyler, TX Metro Area","109,601","± 1,535"
"Urban Honolulu, HI Metro Area","462,629","± 3,258"
"Utica-Rome, NY Metro Area","129,997","± 1,661"
"Valdosta, GA Metro Area","62,796","± 1,590"
"Vallejo, CA Metro Area","209,241","± 1,964"
"Victoria, TX Metro Area","44,557","± 952"
"Vineland, NJ Metro Area","63,333","± 1,089"
"Virginia Beach-Chesapeake-Norfolk, VA-NC Metro Area","826,079","± 4,592"
"Visalia, CA Metro Area","192,571","± 2,391"
"Waco, TX Metro Area","136,096","± 1,688"
"Walla Walla, WA Metro Area","28,129","± 748"
"Warner Robins, GA Metro Area","88,532","± 1,971"
"Washington-Arlington-Alexandria, DC-VA-MD-WV Metro Area","3,338,015","± 6,826"
"Waterbury-Shelton, CT Metro Area","228,532","± 2,332"
"Waterloo-Cedar Falls, IA Metro Area","85,555","± 1,164"
"Watertown-Fort Drum, NY Metro Area","44,454","± 881"
"Wausau, WI Metro Area","72,092","± 745"
"Weirton-Steubenville, WV-OH Metro Area","50,677","± 983"
"Wenatchee-East Wenatchee, WA Metro Area","57,840","± 1,322"
"Wheeling, WV-OH Metro Area","60,384","± 1,005"
"Wichita, KS Metro Area","310,387","± 2,825"
"Wichita Falls, TX Metro Area","67,558","± 1,563"
"Wildwood-The Villages, FL Metro Area","30,456","± 1,223"
"Williamsport, PA Metro Area","52,630","± 832"
"Wilmington, NC Metro Area","206,784","± 2,071"
"Winchester, VA-WV Metro Area","69,078","± 1,287"
"Winston-Salem, NC Metro Area","316,250","± 3,137"
"Worcester, MA Metro Area","443,268","± 3,187"
"Yakima, WA Metro Area","110,162","± 1,887"
"York-Hanover, PA Metro Area","232,712","± 2,063"
"Youngstown-Warren, OH Metro Area","189,481","± 2,012"
"Yuba City, CA Metro Area","74,658","± 1,579"
"Yuma, AZ Metro Area","75,751","± 1,442"